{
  "schemaVersion": 2,
  "framework": "Open Agent Architecture (OAA)",
  "version": "1.1.0",
  "updatedAt": "2026-08-02",
  "purpose": "Single verifiable architecture contract for 12-Factor AI Agent governance, including Obsidian ground-truth vault and cross-session Harness",
  "operatingModel": {
    "controlPlane": {
      "orchestrator": "Codex Primary Control Plane",
      "dagEngine": "OMO DAG Orchestrator",
      "executorLayer": "LazyCodex Sandboxed Executor & QA Gate",
      "memoryStore": {
        "ingestion": "LLM Wiki / raw source index",
        "groundTruth": "Obsidian Markdown Vault (human-confirmed decisions, reviews, experience)",
        "session": "Harness (cross-session task state, checkpoints, receipts)"
      }
    },
    "harness": {
      "purpose": "Cross-session task state, checkpoints and cryptographic receipts",
      "checkpointMinutes": 15,
      "stateFormat": "JSON receipts + git-backed history",
      "survivesCompaction": true
    },
    "obsidian": {
      "purpose": "Human ground truth for decisions, reviews and long-term experience",
      "format": "Markdown vault",
      "authority": "Human-confirmed content is authoritative over AI-generated content"
    },
    "factors": [
      "Factor 1: Single Control Plane",
      "Factor 2: Context Budgeting",
      "Factor 3: Structured Outputs & Gates",
      "Factor 4: Controlled Tool Routing",
      "Factor 5: Fast-Path Execution",
      "Factor 6: Memory Separation (Obsidian Vault + Session Harness)",
      "Factor 7: Auditable Multi-Agent DAG",
      "Factor 8: Cryptographic Receipts",
      "Factor 9: Self-Evolution Loop",
      "Factor 10: Zero-Trust Security Boundary",
      "Factor 11: Ecosystem Multi-Language Support",
      "Factor 12: Independent Architecture Delivery"
    ],
    "taskStates": [
      "pending", "running", "awaiting_approval", "paused", "degraded", "blocked", "failed", "cancelled", "passed"
    ],
    "multiLanguageSupport": ["en-US", "zh-CN", "ja-JP", "es-ES", "de-DE"],
    "securityPolicy": {
      "sandboxMode": "workspace-write",
      "sanitizer": "automatic-credential-masking",
      "approvalPolicy": "explicit-user-escalation-for-write-outside-workspace"
    }
  }
}